{
  "schema_version": "1.0.0",
  "job_id": "example-fictional-001",
  "status": "BLOCKED",
  "exit_code": 15,
  "error_code": "BACKGROUND_UNRESOLVED",
  "error_message": "The approved background registry is unresolved.",
  "execution_profile": "human_local_nvidia_16gb",
  "workflow_version": "graph-spec-1.0.0",
  "dependency_lock_version": "runtime-lock-1.0.0",
  "source_sha256": "0000000000000000000000000000000000000000000000000000000000000000",
  "prompt": "hoi4_portrait, an adult person with short hair, glasses, and a neutral expression",
  "seeds": [],
  "dependencies": [],
  "candidate_paths": [],
  "selected_candidate": null,
  "audits": {
    "identity": null,
    "style": null,
    "mask": null,
    "provenance": null
  },
  "final_png": null,
  "final_dds": null,
  "final_checksums": null,
  "manifest_path": null,
  "comparison_sheet_path": null,
  "warnings": [],
  "blockers": [
    "The approved background registry is unresolved.",
    "No production candidate or DDS is claimed."
  ],
  "timing": {
    "created_at": "2026-07-28T00:00:00Z"
  },
  "peak_memory": null
}
